{
  "modelVersion": "1.0.0",
  "standardId": "cn-compulsory-2022",
  "subjectId": "chinese",
  "routeSubject": "chinese",
  "provenance": "project-operationalization",
  "evidencePolicy": { "singleObservationIsMastery": false, "firstUseMaxModels": 1, "minimumIndependentObservations": 2, "transferRequired": true, "defaultState": "session-only" },
  "models": [
    {
      "modelId": "chinese.cultural-confidence.contextual-understanding.v1",
      "competencyId": "chinese.cultural-confidence",
      "gradeBand": "1-9",
      "observableEvidence": ["能结合文本语言和背景说明文化内容而非只贴标签", "能比较传统表达与当下经验并说明依据和边界"],
      "task": { "taskType": "cultural-context-reading", "promptContract": "从课文选一个文化意象或观念，圈出文本证据并解释其在语境中的意义。", "successCriteria": ["解释引用具体词句或情节", "能区分文本意义与自己的延伸联想"] },
      "feedbackAdjustment": { "whenMissing": "退回一个关键词和上下文，只解释它在本段的作用。", "whenEmerging": "补一条背景或对比证据，说明它如何改变理解。", "whenDemonstrated": "换到不同体裁或时代文本，比较同一意象的变化。", "retest": "用新文本独立完成证据—语境—文化理解。" },
      "capabilityBindings": ["chinese-classical-revival", "chinese-reading-decoder"]
    },
    {
      "modelId": "chinese.language-use.precise-expression.v1",
      "competencyId": "chinese.language-use",
      "gradeBand": "1-9",
      "observableEvidence": ["能根据对象、目的和语境选择准确连贯的表达", "能发现并修改影响意义的词句、衔接或语病"],
      "task": { "taskType": "purposeful-revision", "promptContract": "让学生先说明表达目的，再修改一段文字并逐处解释修改理由。", "successCriteria": ["修改与表达目的直接相关", "修改后语义准确、前后连贯且能说明理由"] },
      "feedbackAdjustment": { "whenMissing": "先只确定这段话要让读者知道或感受到什么。", "whenEmerging": "每次只改最影响意义的一处并比较前后效果。", "whenDemonstrated": "更换读者或文体，要求重新调整表达。", "retest": "用新段落独立完成目的—修改—理由。" },
      "capabilityBindings": ["chinese-writing-coach", "chinese-grammar-tracker"]
    },
    {
      "modelId": "chinese.thinking.claim-evidence.v1",
      "competencyId": "chinese.thinking",
      "gradeBand": "1-9",
      "observableEvidence": ["能从文本中提出问题、概括关系或形成观点", "能用文本证据检验推断并考虑其他解释"],
      "task": { "taskType": "reading-inference", "promptContract": "围绕一个阅读问题写观点、两条证据和一个可能反例，再修正观点。", "successCriteria": ["观点回应设问且证据相关", "能说明证据如何支持观点并处理反例"] },
      "feedbackAdjustment": { "whenMissing": "退回设问关键词和一条直接证据。", "whenEmerging": "追问证据与观点之间缺少哪一步说明。", "whenDemonstrated": "加入含混或冲突细节，要求比较两种解释。", "retest": "用新文本完成观点—证据—反例链。" },
      "capabilityBindings": ["chinese-reading-decoder", "chinese-writing-coach"]
    },
    {
      "modelId": "chinese.aesthetic-creation.effect-revision.v1",
      "competencyId": "chinese.aesthetic-creation",
      "gradeBand": "1-9",
      "observableEvidence": ["能感受并说明词句、结构或形象产生的表达效果", "能用自己的语言进行有目的的改写或创作并评价效果"],
      "task": { "taskType": "aesthetic-revision", "promptContract": "选择一个关键句，说明其语言效果，再做一次保留原意的不同风格改写。", "successCriteria": ["效果判断落到具体语言形式", "改写有明确意图且能比较得失"] },
      "feedbackAdjustment": { "whenMissing": "先只找一个重复、对比、节奏或意象特征。", "whenEmerging": "要求把好看改写成具体读者感受和语言原因。", "whenDemonstrated": "改变语气、节奏或叙述视角并评价新效果。", "retest": "用新文本独立完成形式—效果—改写。" },
      "capabilityBindings": ["chinese-reading-decoder", "chinese-writing-coach", "chinese-classical-revival"]
    }
  ]
}
